pillar_id,pillar,simulation_meaning
PILLAR_001,No history without inputs.,"A war needs food, claims, fear, profit, revenge, religion or survival."
PILLAR_002,No magic without cost.,"Every magical act consumes body, time, catalysts, training, legitimacy or political trust."
PILLAR_003,No species as stereotypes.,"Orcs, elves and dwarves must have internal class divisions, regional cultures, allies, traitors, rulers, peasants and contradictions."
PILLAR_004,No clean good and evil factions.,"Every side should have reasons, crimes, debts and fears."
PILLAR_005,No world that waits for the player.,"The observer watches history unfold through chronicles, ledgers, battle reports, biographies, maps and conflicting historians."
PILLAR_006,No fantasy names without history.,"Important names need local, common, imperial, religious, enemy and scholar layers."
